Title;Desc;Type;BodyPart;Equipment;Level;Rating;VideoLink
Barbell roll-out;The barbell roll-out is an abdominal exercise that utilizes a barbell in the place of an ab roller. It is best performed with a barbell that has rotating collars, and is considered more difficult than other ab roller variations. Many lifters may not be able to perform a single rep at first, but once they can perform these for reps, they'll be rewarded with a seriously strong core.;Strength;Abdominals;Barbell;Intermediate;8.9;https://www.youtube.com/watch?v=s_elM3ciI8g&pp=ygUQQmFyYmVsbCByb2xsLW91dA%3D%3D
Barbell Ab Rollout - On Knees;The barbell roll-out is an abdominal exercise that utilizes a barbell in the place of an ab roller. It is best performed with a barbell that has rotating collars, and is considered more difficult than other ab roller variations. Many lifters may not be able to perform a single rep at first, but once they can perform these for reps, they'll be rewarded with a seriously strong core.;Strength;Abdominals;Barbell;Intermediate;8.9;https://www.youtube.com/watch?v=MW8pIlUhkBE&pp=ygUdQmFyYmVsbCBBYiBSb2xsb3V0IC0gT24gS25lZXM%3D
Decline bar press sit-up;The decline bar press sit-up is a weighted core exercise targeting the abdominal muscles, particularly the lower abs. It also challenges the shoulders and upper back to move the weight. Weighted sit-up variations are usually performed for moderate to high reps, such as 8-12 reps per set or more, as part of the core-focused portion of a workout.;Strength;Abdominals;Barbell;Intermediate;8.5;https://www.youtube.com/watch?v=K95OZFpJKuw&pp=ygUYRGVjbGluZSBiYXIgcHJlc3Mgc2l0LXVw
Bench barbell roll-out;The bench barbell roll-out is a challenging exercise targeting the abdominals. It is similar to using an ab roller, but using a barbell allows for a wider grip. Placing the knees on a bench rather than the floor makes the move more difficult by increasing the challenge to the upper body.;Strength;Abdominals;Barbell;Beginner;8.5;https://www.youtube.com/watch?v=RVGYevyytlc&pp=ygUWQmVuY2ggYmFyYmVsbCByb2xsLW91dA%3D%3D
Barbell Side Bend;The Barbell Side Bend is a standing exercise that targets the obliques, the muscles on the sides of the waist. With a barbell held across the shoulders or behind the head, the individual lowers their body to one side as far as comfortable, feeling a stretch in the obliques. The movement is then repeated on the opposite side. This exercise is great for improving core stability and can be performed with different weights to increase the intensity.;Strength;Abdominals;Barbell;Beginner;8.3;https://www.youtube.com/watch?v=CnsLmYb6tTw&pp=ygURQmFyYmVsbCBTaWRlIEJlbmQ%3D
Seated bar twist;The seated bar twist is a core exercise meant to strengthen the obliques. It is often performed for high reps with relatively light weight, such as an empty barbell, a lightweight fixed-weight bar, or even a PVC pipe. It can be performed during a workout, at the end of a workout, or outside of the gym to build core strength and resiliency.;Strength;Abdominals;Barbell;Intermediate;8.2;https://www.youtube.com/watch?v=cfUXRs1PylY&pp=ygUQU2VhdGVkIGJhciB0d2lzdA%3D%3D
Advanced Kettlebell Windmill;The advanced kettlebell windmill is a unilateral exercise that targets the core, shoulders, hips, and hamstrings. To perform this exercise, stand with your feet shoulder-width apart while holding a kettlebell in your right hand. Keep your right arm extended overhead while lowering your torso towards the floor with your left arm reaching towards the ground. Return to standing position and repeat on the opposite side. This exercise requires balance and stability, making it a challenging yet effective full-body workout.;Strength;Abdominals;Kettlebells;Beginner;4.7;https://www.youtube.com/watch?v=H8fmeaq8ewI&pp=ygUcQWR2YW5jZWQgS2V0dGxlYmVsbCBXaW5kbWlsbA%3D%3D
Kettlebell Windmill;The single-kettlebell windmill is a dynamic kettlebell exercise emphasizing core strength and shoulder and hip mobility and stability. It is often used as a functional warm-up or for multi-directional strength work. It doesn't work as well in a metcon or conditioning setting, and shouldn't be performed under intense fatigue.;Strength;Abdominals;Kettlebells;Intermediate;8.2;https://www.youtube.com/watch?v=q8K_Wg8OuV4&pp=ygUTS2V0dGxlYmVsbCBXaW5kbWlsbA%3D%3D
Kettlebell Pass Between The Legs;The Kettlebell Pass Between The Legs is a compound exercise that targets the lower body, core, and upper back. To perform the exercise, stand with your feet shoulder-width apart, holding the kettlebell with both hands in front of you. Keeping your back straight and core engaged, swing the kettlebell back between your legs, then pass it to your other hand and swing it forward to chest height. Repeat, passing the kettlebell between your legs with each swing. This exercise helps improve explosive power, flexibility, and coordination.;Strength;Abdominals;Kettlebells;Beginner;7.7;https://www.youtube.com/watch?v=dPqGBoegbj8&pp=ygUgS2V0dGxlYmVsbCBQYXNzIEJldHdlZW4gVGhlIExlZ3M%3D
Dumbbell V-Sit Cross Jab;The dumbbell V-sit cross jab is a hybrid movement that trains the abdominal and shoulder muscles simultaneously. It can address multiple muscle groups in a time-efficient muscle-building or circuit-style workout, while also providing a cardiovascular challenge.;Strength;Abdominals;Dumbbell;Intermediate;8.2;https://www.youtube.com/watch?v=k4vFGA7qOb4&pp=ygUYRHVtYmJlbGwgVi1TaXQgQ3Jvc3MgSmFi
Dumbbell spell caster;The dumbbell spell caster is an exercise that primarily targets the abdominal muscles such as the obliques. However, it also works shoulders, back, hips, and legs, and demands all of those muscles work together in a coordinated motion. It is usually performed with relatively light weights for moderate to high reps, at least 8-12 reps per side. Make sure to only use a weight you can control.;Strength;Abdominals;Dumbbell;Beginner;9.3;https://www.youtube.com/watch?v=fxL497_e6WI&pp=ygUVRHVtYmJlbGwgc3BlbGwgY2FzdGVy
Dumbbell side bend;The dumbbell side bend is a popular exercise for targeting the oblique muscles of the abdomen. It is usually performed for relatively high reps, at least 8-12 reps per set or more. It can be performed one side at a time or alternating sides.;Strength;Abdominals;Dumbbell;Intermediate;9.3;https://www.youtube.com/watch?v=dL9ZzqtQI5c&pp=ygUSRHVtYmJlbGwgc2lkZSBiZW5k
Landmine twist;The landmine twist is a rotational abdominal movement performed using an angled barbell anchored at floor level in a landmine device. It can also be performed by sticking a barbell in the corner of a room, preferably in a towel to protect the walls. It targets the deep muscles of the core, including both the obliques and the transversus abdominis. It can be done fast or slow, for time or reps, either in traditional muscle-focused rep ranges such as 8-12 reps per side or for higher rep ranges.;Strength;Abdominals;Other;Intermediate;8.6;https://www.youtube.com/watch?v=QDakeCOBdDE&pp=ygUOTGFuZG1pbmUgdHdpc3Q%3D
Suspended ab fall-out;"The suspended ab fall-out is a dynamic abdominal exercise utilizing a suspension strap system or gymnastic rings. It is similar in form to an ab roller, but can more easily be scaled to be more or less difficult. It targets the muscles of the rectus abdominis or ""six-pack"" muscles, as well as the deep core muscles. It can be trained for low reps for strength or higher reps for muscle definition.";Strength;Abdominals;Other;Intermediate;9.5;https://www.youtube.com/watch?v=0FAMdxWgFnA&pp=ygUVU3VzcGVuZGVkIGFiIGZhbGwtb3V0
Decline reverse crunch;The decline reverse crunch is a popular bodyweight exercise targeting the abdominal muscles, particularly the lower abs. It is usually performed for high reps, such as 10-15 reps per set or more, as part of the ab-focused portion of a workout.;Strength;Abdominals;Other;Intermediate;9.3;https://www.youtube.com/watch?v=YcMj0EEadQo&pp=ygUWRGVjbGluZSByZXZlcnNlIGNydW5jaA%3D%3D
Plate Twist;The Plate Twist exercise is a core strengthening workout that targets the obliques. It involves sitting on the floor with the legs slightly bent and holding a weight plate or medicine ball in both hands. The torso is then twisted from side to side with the weight plate or medicine ball, engaging the oblique muscles. This exercise helps to improve balance, stability and overall core strength.;Strength;Abdominals;Other;Beginner;9.2;https://www.youtube.com/watch?v=vWZNWuLCS44&pp=ygULUGxhdGUgVHdpc3Q%3D
Weighted Crunches;"The weighted suitcase crunch is a weighted version of a popular abdominal training exercise. The simple addition of a weight makes the suitcase crunch far more difficult, helping build the ""six pack"" muscles and providing a different stimulus to the core during training.";Strength;Abdominals;Other;Intermediate;8.2;https://www.youtube.com/watch?v=cbwLMF7oJGI&pp=ygURV2VpZ2h0ZWQgQ3J1bmNoZXM%3D
Ab Roller;The ab wheel roll-out is an exercise targeting the abdominals, often with an inexpensive wheel device with a handle on either side. Many trainers and strength coaches claim it's one of, if no the best exercise for developing strength in the midsection. Beginners may have to start with a limited range of motion or just wheel planks.;Strength;Abdominals;Other;Intermediate;8.9;https://www.youtube.com/watch?v=9ZCoAbI7uX0&pp=ygUJQWIgUm9sbGVy
Otis-Up;The Otis-up is a weighted exercise focusing on the abdominal muscles, as well as the shoulders to a lesser degree. It primarily targets the rectus abdominus or вЂњsix-packвЂќ muscles, but also involves the obliques and deep core muscles. It is normally performed on a decline bench holding a weight plate, but can also be performed with a dumbbell, kettlebell, or other weight.;Strength;Abdominals;Other;Intermediate;8.9;https://www.youtube.com/watch?v=vjAjAERSkIk&pp=ygUHT3Rpcy1VcA%3D%3D
Captain's chair knee raise;The captain's chair knee raise is a bodyweight exercise that targets the abs. It is performed on an apparatus that allows the forearms to rest on pads and the upright torso to hang freely. Knee raises are often performed for moderate to high reps, such as 8-12 reps or more, as part of ab-focused training.;Strength;Abdominals;Other;Intermediate;8.8;https://www.youtube.com/watch?v=7KDDZtaUaxw&pp=ygUaQ2FwdGFpbidzIGNoYWlyIGtuZWUgcmFpc2U%3D
Sledgehammer swing;The sledgehammer swing is an exercise working the abdominals and numerous other muscles. The sledgehammer is slammed from overhead onto a tire which absorbs the impact and causes the hammer to bounce back up. It can be performed for time or reps as part of a functional fitness or athleticism-focused workout.;Plyometrics;Abdominals;Other;Intermediate;8.6;https://www.youtube.com/watch?v=GX_EnqzsLgw&pp=ygUSU2xlZGdlaGFtbWVyIHN3aW5n
Decline bar press sit-up;The decline bar press sit-up is a weighted core exercise targeting the abdominal muscles, particularly the lower abs. It also challenges the shoulders and upper back to move the weight. Weighted sit-up variations are usually performed for moderate to high reps, such as 8-12 reps per set or more, as part of the core-focused portion of a workout.;Strength;Abdominals;Barbell;Intermediate;8.6;https://www.youtube.com/watch?v=K95OZFpJKuw&pp=ygUYRGVjbGluZSBiYXIgcHJlc3Mgc2l0LXVw
Pallof press;"The Pallof press is an isometric exercise that trains core stability. It involves resisting rotation from a cable or band, developing what is sometimes called ""anti-rotation"" core strength. It is most often seen in programs for athletes who compete in sports that test strength, power, and functional movements. It can be trained in timed holds or for reps by pressing the cable or band away from the body.";Strength;Abdominals;Other;Intermediate;8.5;https://www.youtube.com/watch?v=5_8d8vHgZvU&pp=ygUMUGFsbG9mIHByZXNz
Weighted Sit-Ups - With Bands;The weighted sit-up is a more difficult version of a highly popular abdominal movement. The simple addition of a weight makes the sit-up far more difficult, providing a different stimulus to the core during training and helping build strong abs.;Strength;Abdominals;Other;Intermediate;8.5;https://www.youtube.com/watch?v=FQogbZX_JyY&pp=ygUdV2VpZ2h0ZWQgU2l0LVVwcyAtIFdpdGggQmFuZHM%3D
Standing cable low-to-high twist;The standing cable low-to-high twist is a core exercise targeting the upper abdominals and the obliques. Take care to perform it with control, as opposed to violent twisting which can injure the back. It is usually performed for moderate to high reps, at least 8-15 per side, as part of the core-focused portion of a workout.;Strength;Abdominals;Cable;Intermediate;8.4;https://www.youtube.com/watch?v=rHfjG2Oflz0&pp=ygUgU3RhbmRpbmcgY2FibGUgbG93LXRvLWhpZ2ggdHdpc3Q%3D
Single-arm high-cable side bend;The single-arm high-cable side bend is an exercise targeting the obliques using a cable stack machine.;Strength;Abdominals;Cable;Intermediate;8.0;https://www.youtube.com/watch?v=JSFj7Fzq2yE&pp=ygUfU2luZ2xlLWFybSBoaWdoLWNhYmxlIHNpZGUgYmVuZA%3D%3D
Kneeling cable oblique crunch;"The kneeling cable oblique crunch is a popular core isolation exercise using a rope attachment and cable stack while kneeling on the floor. It primarily targets the obliques and rectus abdominis or ""six-pack"" muscles, but also strengthens the deep core muscles. It is most commonly performed for moderate to high reps, such as 8-12 reps per set or higher.";Strength;Abdominals;Cable;Intermediate;9.3;https://www.youtube.com/watch?v=tgusmyhJKgU&pp=ygUdS25lZWxpbmcgY2FibGUgb2JsaXF1ZSBjcnVuY2g%3D
Kneeling cable crunch;"The kneeling cable crunch is a popular core isolation exercise using a rope attachment and cable stack while kneeling on the floor. It primarily targets the rectus abdominis or ""six-pack"" muscles, but also strengthens the deep core muscles. It is most commonly performed early in an ab workout, usually in moderate to high reps, such as 8-12 reps per set or higher.";Strength;Abdominals;Cable;Intermediate;9.1;https://www.youtube.com/watch?v=AV5PmZJIrrw&pp=ygUVS25lZWxpbmcgY2FibGUgY3J1bmNo
Rope Crunch;"The kneeling cable crunch is a popular core isolation exercise using a rope attachment and cable stack while kneeling on the floor. It primarily targets the rectus abdominus or ""six-pack"" muscles, but also strengthens the deep core muscles. It is most commonly performed early in an ab workout, usually in moderate to high reps like 8-12 reps per set or higher.";Strength;Abdominals;Cable;Intermediate;9.0;https://www.youtube.com/shorts/ePSIfIgoZWo
Standing cable crunch;"The standing cable crunch is a popular core isolation exercise using a rope attachment. It primarily targets the rectus abdominis or ""six-pack"" muscles, but also strengthens the deep core muscles. It is most commonly performed early in an ab workout, usually in moderate to high reps, such as 8-12 reps per set or higher.";Strength;Abdominals;Cable;Intermediate;8.9;https://www.youtube.com/watch?v=vFV78ASgsak&pp=ygUVU3RhbmRpbmcgY2FibGUgY3J1bmNo
Bosu Ball Cable Crunch With Side Bends;The Bosu Ball Cable Crunch with Side Bends exercise consists of lying on a Bosu Ball with your feet on the floor. Then, take a cable attached to a mid-level pulley and place it around the back of your neck, crossing your arms over your chest. Next, crunch forward and to the side to work your obliques. The Bosu Ball adds an extra challenge by requiring you to engage your core muscles to maintain balance.;Strength;Abdominals;Cable;Beginner;8.6;https://www.youtube.com/watch?v=ghrP6z8spxo&pp=ygUmQm9zdSBCYWxsIENhYmxlIENydW5jaCBXaXRoIFNpZGUgQmVuZHM%3D
Standing Cable Wood Chop;The standing cable high-to-low twist is a core exercise targeting the lower abdominals and the obliques.;Strength;Abdominals;Cable;Intermediate;8.6;https://www.youtube.com/watch?v=DoACGlPyQTI&pp=ygUYU3RhbmRpbmcgQ2FibGUgV29vZCBDaG9w
Cable reverse crunch;The cable reverse crunch is performed on the ground facing away from a high pulley, which helps target the lower abdominals specifically.;Strength;Abdominals;Cable;Beginner;8.2;https://www.youtube.com/watch?v=Ss3G7RnIjV4&pp=ygUUQ2FibGUgcmV2ZXJzZSBjcnVuY2g%3D
Cable Russian Twists;The Cable Russian Twists exercise is a core strength training exercise that primarily targets the abdominal muscles and obliques. It involves sitting on a bench with your torso angled back and a cable machine or resistance band attached to one side of your body. With both hands holding the cable, you twist your torso to the opposite side while maintaining a stable and engaged core. The exercise can be varied by increasing the weight resistance and adding more repetitions or sets for a more challenging workout.;Strength;Abdominals;Cable;Beginner;8.2;https://www.youtube.com/watch?v=4SqdOON5URQ&pp=ygUUQ2FibGUgUnVzc2lhbiBUd2lzdHM%3D
Pallof press with rotation;The Pallof press with rotation is a dynamic variation of the Pallof press that incorporates weighted rotation away from the torso using resistance from a cable pulley. It is intended to build abdominal strength and teach proper bracing. It can be performed for time or for reps in the core-focused portion of any workout.;Strength;Abdominals;Cable;Intermediate;8.2;https://www.youtube.com/watch?v=zoYwuVw3kkQ&pp=ygUaUGFsbG9mIHByZXNzIHdpdGggcm90YXRpb24%3D
Cable Seated Crunch;The Cable Seated Crunch is a core strengthening exercise that targets the rectus abdominis muscles. It is performed by sitting on a bench, holding onto a cable with both hands, and then curling the torso forward towards the knees while keeping the feet firmly planted on the ground. This exercise offers resistance through the cable, making it challenging to maintain control throughout the movement. It is suitable for individuals of all fitness levels and can be modified by adjusting the weight on the cable machine.;Strength;Abdominals;Cable;Beginner;8.2;https://www.youtube.com/watch?v=mkE_gNDQN8o&pp=ygUTQ2FibGUgU2VhdGVkIENydW5jaA%3D%3D
Cable Judo Flip;The Cable Judo Flip exercise involves grasping the handle of two cables attached to a cable machine and performing a throwing motion similar to that of a Judo throw. The movement involves a twisting motion and a push-pull action of the arms, engaging the core, back, shoulders, and arms. The exercise improves strength and stability, particularly in the anterior and posterior muscles of the upper body. It is recommended that this exercise be performed under supervision and with a weight appropriate to the individual's strength and skill level.;Strength;Abdominals;Cable;Beginner;7.9;https://www.youtube.com/watch?v=CF3aIsvzKUE&pp=ygUPQ2FibGUgSnVkbyBGbGlw
Ab Crunch Machine;The machine crunch is a machine-based exercise targeting the abdominal muscles. It involves sitting upright in the machine and curling the torso down toward the chest against some pre-set level of resistance. On some machines, the knees also curl up torward the torso. Crunch machines usually use extra resistance in the form of selectorized weight stacks or plate loading, and are often performed for moderate to high reps, like 8-12 reps per set or higher, as part of the ab-focused portion of a workout.;Strength;Abdominals;Machine;Intermediate;8.2;https://www.youtube.com/watch?v=_O1xunCfYEM&pp=ygURQWIgQ3J1bmNoIE1hY2hpbmU%3D
Smith machine straight-legged hip raise;The Smith machine straight-legged hip raise is an exercise targeting the abdominal muscles. Because of the potential awkwardness of getting into position, it is usually performed for moderate to high reps, such as 8-12 reps per set or more. If your Smith machine has safety bars, set them at a height that allows you a full range of motion while giving adequate protection from the weight potentially falling.;Strength;Abdominals;Machine;Intermediate;8.2;https://www.youtube.com/watch?v=eCDlRpeo73A&pp=ygUnU21pdGggbWFjaGluZSBzdHJhaWdodC1sZWdnZWQgaGlwIHJhaXNl
Elbow plank;The elbow plank is a popular isometric abdominal exercise. It is common in all types of exercise programs, as well as in group fitness and yoga classes. It targets the muscles of the core, the deep core or transversus abdominis in particular. It is also often prescribed for time to help back pain or to teach proper bracing.;Strength;Abdominals;Body Only;Intermediate;8.0;https://www.youtube.com/watch?v=qmw7-IFVZPo&pp=ygULRWxib3cgcGxhbms%3D
Bottoms Up;The lying leg lift is a popular bodyweight exercise targeting the muscles of the abs, the rectus abdominis or вЂњsix-packвЂќ muscles in particular. It can be performed for time or reps in the core-focused portion of any workout.;Strength;Abdominals;Body Only;Intermediate;8.0;https://www.youtube.com/watch?v=ekAXPCphKXQ&pp=ygUKQm90dG9tcyBVcA%3D%3D
Spider crawl;The spider crawl is a bodyweight exercise that involves crawling on the floor with the knees outside of the elbows. It is different from a leopard crawl in that the hips are higher, and it's different from a bear crawl because the knees are wider. It can be done as a full-body warm-up, in short bursts for power or circuit training, or for longer durations as cardiovascular conditioning.;Strength;Abdominals;Body Only;Intermediate;9.3;https://www.youtube.com/watch?v=2Jczv6yuV_Y&pp=ygUMU3BpZGVyIGNyYXds
Cocoons;"The cocoon crunch is a bodyweight exercise targeting the ab muscles, the rectus abdominis or ""six-pack"" muscles in particular. It involves bringing your knees to your chest and your arms from overhead to center. It can be performed for time or reps as part of the ab-focused portion of any workout.";Strength;Abdominals;Body Only;Intermediate;9.3;https://www.youtube.com/watch?v=p_GnJTl2HqI&pp=ygUHQ29jb29ucw%3D%3D
Cross-Body Crunch;"The elbow-to-knee crunch is a bodyweight exercise targeting the ab muscles, the obliques and rectus abdominis or ""six-pack"" muscles in particular. It can be performed for time or reps as part of the ab-focused portion of any workout.";Strength;Abdominals;Body Only;Intermediate;9.2;https://www.youtube.com/watch?v=iKtbk1M_TP8&pp=ygURQ3Jvc3MtQm9keSBDcnVuY2g%3D
Elbow-to-knee crunch;"The elbow-to-knee crunch is a bodyweight exercise targeting the ab muscles, the obliques and rectus abdominis or ""six-pack"" muscles in particular. It can be performed for time or reps as part of the ab-focused portion of any workout.";Strength;Abdominals;Body Only;Intermediate;9.1;https://www.youtube.com/watch?v=FcjwuLMdGyM&pp=ygUURWxib3ctdG8ta25lZSBjcnVuY2g%3D
Decline Crunch;The decline crunch is an effective core exercise targeting the rectus abdominis.;Strength;Abdominals;Body Only;Intermediate;9.1;https://www.youtube.com/watch?v=Pbfj9xXFpm0&pp=ygUORGVjbGluZSBDcnVuY2g%3D
Hanging toes-to-bar;The hanging toes-to-bar is an advanced abdominal exercise in which the lifter touches their feet to a pull-up bar. There are many ways to perform this movement (strict or swinging, arms completely straight or slightly bent, legs straight or bent) each providing unique benefits and challenges. Initially, it may be a difficult move to do for a single rep, but once you build the requisite core, lat, and shoulder strength, it can be performed for higher reps.;Strength;Abdominals;Body Only;Intermediate;9.1;https://www.youtube.com/watch?v=S2QVHl6DoNo&pp=ygUTSGFuZ2luZyB0b2VzLXRvLWJhcg%3D%3D
Hanging Oblique Knee Raise;The hanging oblique crunch an abdominal exercise that targets both the rectus abdominus or вЂњsix-packвЂќ muscles, and the oblique muscles. It can be performed hanging from a bar, or if grip strength is a limitation, by placing the elbows in ab straps. If hanging from a straight bar is uncomfortable to the wrists or shoulder, you can also perform them hanging with a neutral grip (palms facing one another);Strength;Abdominals;Body Only;Intermediate;9.0;https://www.youtube.com/watch?v=L1rt7qr5LCk&pp=ygUaSGFuZ2luZyBPYmxpcXVlIEtuZWUgUmFpc2U%3D
Gorilla Chin/Crunch;The Gorilla Chin/Crunch exercise is a combination of a chin-up and a crunch that targets multiple muscle groups simultaneously. To perform the exercise, grip a pull-up bar with palms facing toward the body and hands shoulder-width apart. Lift your legs up so that theyвЂ™re parallel to the ground, and as you pull yourself up towards the bar, crunch your knees towards your chest. Lower yourself back down and repeat for desired number of reps. This exercise helps build upper body and core strength.;Strength;Abdominals;Body Only;Beginner;9.0;https://www.youtube.com/watch?v=4cXIO4_HGsw&pp=ygUTR29yaWxsYSBDaGluL0NydW5jaA%3D%3D
Hanging leg raise;The hanging leg raise is an exercise targeting the abs, but which also works the lats and hip flexors. Instead of resting your forearms on the pads of a captain's chair, you perform these hanging from a bar. Experienced lifters make these look easy, but beginners may need time to build up to sets of 8-12 reps.;Strength;Abdominals;Body Only;Intermediate;9.0;https://www.youtube.com/watch?v=Pr1ieGZ5atk&pp=ygURSGFuZ2luZyBsZWcgcmFpc2U%3D
Mountain climber;The mountain climber is a popular bodyweight exercise targeting the muscles of the core, as well as the shoulders, hips, and cardiovascular system. It involves lifting one knee to the chest at a time from a straight-arm plank position. It can be performed for time or reps as part of a dynamic warm-up, for bodyweight cardio or conditioning, or as no-equipment dynamic core training.;Plyometrics;Abdominals;Body Only;Intermediate;8.2;https://www.youtube.com/watch?v=nmwgirgXLYM&pp=ygUQTW91bnRhaW4gY2xpbWJlcg%3D%3D
Ab bicycle;"The ab bicycle is a bodyweight movement that targets the muscles of the abs, the obliques and rectus abdominis or ""six-pack"" muscles in particular. It can be performed for time or reps in the ab-focused portion of any workout.";Strength;Abdominals;Body Only;Intermediate;8.9;https://www.youtube.com/watch?v=9FGilxCbdz8&pp=ygUKQWIgYmljeWNsZQ%3D%3D
