Title;Desc;Type;BodyPart;Equipment;Level;Rating;VideoLink
Step-up with knee raise;The step-up with knee raise is a lower-body exercise targeting the quads, glutes, and hamstrings. It differs from a traditional step-up in that at the top, you lift the trailing leg up to full hip flexion. This gives the exercise a greater range of motion and more of a focus on powerful hip extension in the working leg. When performed with body weight, these are usually performed for high reps as part of a dynamic warm-up, as cardio acceleration, or as part of the lower-body portion of a workout or circuit.;Strength;Glutes;Body Only;Intermediate;8.8;https://www.youtube.com/watch?v=VEV_b5zPZqY&pp=ygUXU3RlcC11cCB3aXRoIGtuZWUgcmFpc2U%3D
Standing hip extension;The standing hip extension is a movement that activates the glutes and hamstrings. It is often performed either for time or reps as part of a dynamic warm-up.;Strength;Glutes;Body Only;Beginner;8.8;https://www.youtube.com/watch?v=i4rmRxPBmkY&pp=ygUWU3RhbmRpbmcgaGlwIGV4dGVuc2lvbg%3D%3D
Lying glute stretch;The lying glute stretch is a stretch to help increase flexibility in the glutes and hips. It involves rotating a single leg over the body while lying flat on the back, and reaching around the leg to facilitate a stretch. It is commonly included in dynamic warm-ups or cool-downs, but can also be performed as full-body mobility work anytime.;Stretching;Glutes;Body Only;Intermediate;8.7;https://www.youtube.com/watch?v=YBV6d5TluFA&pp=ygUTTHlpbmcgZ2x1dGUgc3RyZXRjaA%3D%3D
Exercise ball hip thrust;The exercise ball hip thrust is a simple yet effective way to work the glutes and hamstrings. Proper form is essential to really feel the burn in the glutes, and the ball can help guide you into the right form better than a bench, which is the usual support for hip thrusts. Unlike the bench version, the ball hip thrust is best performed with body weight or bands as resistance for safety reasons. It can be an excellent component of a warm-up for lower-body training, or a glute activation drill performed anytime.;Strength;Glutes;Exercise Ball;Intermediate;6.5;https://www.youtube.com/watch?v=NFG7WoKTTWg&pp=ygUYRXhlcmNpc2UgYmFsbCBoaXAgdGhydXN0
Barbell Deadlift;"The barbell deadlift is a compound exercise used to develop overall strength and size in the posterior chain. It is a competition lift in the sport of powerlifting, but is also considered a classic benchmark of overall strength. When performed with the hands outside the knees, it is often called a ""conventional"" deadlift. When the feet are wide and the hands are inside the knees, it is a sumo deadlift.";Strength;Hamstrings;Barbell;Intermediate;4.8;https://www.youtube.com/watch?v=vRKDvt695pg&pp=ygUQQmFyYmVsbCBEZWFkbGlmdA%3D%3D
Sumo deadlift;The sumo deadlift is a compound movement in which the feet are set in a wide stance with toes pointed out and grip is placed inside of the legs. It is allowed to be performed instead of conventional deadlifts in most powerlifting competitions. The sumo deadlift targets the hamstrings, glutes, and upper back/traps, but also has a greater emphasis on stretching and strengthening the adductor and hip muscles due to the wide stance.;Powerlifting;Hamstrings;Barbell;Beginner;7.8;https://www.youtube.com/watch?v=XsrD5y8EIKU&pp=ygUNU3VtbyBkZWFkbGlmdA%3D%3D
Power clean;"The power clean is a full-body movement in which the bar is pulled from the floor and caught in the front rack position in three pulls or phases. The bar is received in the ""power"" position, with the hips higher than a full-depth squat position. The power clean can be used as a component of the clean and press or clean and jerk, but is also a valuable lift to build explosive power and strength.";Strength;Hamstrings;Barbell;Intermediate;9.4;https://www.youtube.com/watch?v=O32-Ae8SNIc&pp=ygULUG93ZXIgY2xlYW4%3D
Good Morning;The barbell good morning is an exercise that targets glute, hamstring, and lower back development. It is often trained as an accessory movement to the deadlift, but also has value on its own. It is sometimes performed for reps in traditional strength-focused rep ranges such as 5-8 reps per set, but due to the risk posed to the lower back, is rarely treated as a max-effort single-rep lift.;Powerlifting;Hamstrings;Barbell;Intermediate;9.3;https://www.youtube.com/watch?v=6CHs4x2uqcQ&pp=ygUMR29vZCBNb3JuaW5n
Barbell stiff-legged deadlift;The barbell stiff-legged deadlift targets the hamstrings, glutes, lower and upper back, as well as the core. It is a popular accessory movement for the deadlift, but also a muscle-building hamstring movement.;Strength;Hamstrings;Barbell;Intermediate;8.7;https://www.youtube.com/watch?v=1uDiW5--rAE&pp=ygUdQmFyYmVsbCBzdGlmZi1sZWdnZWQgZGVhZGxpZnQ%3D
Romanian Deadlift;The barbell stiff-legged deadlift targets the hamstrings, glutes, lower and upper back, as well as the core. It is a popular accessory movement for the deadlift, but also a muscle-building hamstring movement.;Strength;Hamstrings;Barbell;Intermediate;8.5;https://www.youtube.com/watch?v=FUwsp0OVyVM&pp=ygURUm9tYW5pYW4gRGVhZGxpZnQ%3D
Kettlebell pass-through lunge;The kettlebell pass-through lunge is a dynamic leg and core exercise in which a lifter passes a weight under their front leg during lunges. It is a unique coordination challenge, but also challenging to the musculature of the abdomen, lower body, shoulders, and upper back. It is most commonly performed for higher reps, such as 10-15 reps per side, or for time. It can work in circuit-style workouts, or in lower-body or full-body time-efficient training.;Strength;Hamstrings;Kettlebells;Intermediate;8.3;https://www.youtube.com/watch?v=FiD6kwnxx30&pp=ygUdS2V0dGxlYmVsbCBwYXNzLXRocm91Z2ggbHVuZ2U%3D
Kettlebell One-Legged Deadlift;The kettlebell single-leg deadlift is a variation on the kettlebell deadlift where one foot stays planted on the ground while the other raises into the air at the bottom of the movement. It's popular in lower-body training for strength and muscle building, but also trains balance, grip, and the core muscles.;Strength;Hamstrings;Kettlebells;Intermediate;8.1;https://www.youtube.com/watch?v=b9bHy3ojQWA&pp=ygUeS2V0dGxlYmVsbCBPbmUtTGVnZ2VkIERlYWRsaWZ0
Single-arm kettlebell clean;The single-arm kettlebell clean is an explosive kettlebell exercise where the lifter pulls the weight to shoulder level in a single movement. While the kettlebell clean is often used as a transitional movement into the press or front squat, it is also a valuable strength and power exercise in its own right. It can be performed in low rep ranges for strength or higher rep ranges for technique practice or muscle growth.;Strength;Hamstrings;Kettlebells;Beginner;8.7;https://www.youtube.com/watch?v=IVvmnmG0BfE&pp=ygUbU2luZ2xlLWFybSBrZXR0bGViZWxsIGNsZWFu
Single-leg kettlebell deadlift;The kettlebell single-leg deadlift is a variation on the kettlebell deadlift where one foot stays planted on the ground while the other raises into the air at the bottom of the movement. It's popular in lower-body training for strength and muscle building, but also trains balance, grip, and the core muscles.;Strength;Hamstrings;Kettlebells;Intermediate;8.6;https://www.youtube.com/watch?v=o0rblOFkuho&pp=ygUeU2luZ2xlLWxlZyBrZXR0bGViZWxsIGRlYWRsaWZ0
Single-arm kettlebell swing;The single-arm kettlebell swing is a popular exercise emphasizing the muscles of the hamstrings, glutes, and back. Because you are only swinging with one arm at a time, it is also uniquely challenging to the grip and core muscles. It is often used to train explosive power, for aerobic or cardiovascular conditioning, or in circuit training.;Strength;Hamstrings;Kettlebells;Intermediate;8.6;https://www.youtube.com/watch?v=BXrXhyudA80&pp=ygUbU2luZ2xlLWFybSBrZXR0bGViZWxsIHN3aW5n
Romanian Deadlift With Dumbbells;The dumbbell stiff-legged deadlift targets the hamstrings, glutes, low and upper back, as well as the core. The purpose of the stiff-legged, as opposed to Romanian deadlift with slightly bent knees, is to engage the hamstrings and low back to an even greater degree.;Strength;Hamstrings;Dumbbell;Beginner;8.2;https://www.youtube.com/watch?v=hQgFixeXdZo&pp=ygUgUm9tYW5pYW4gRGVhZGxpZnQgV2l0aCBEdW1iYmVsbHM%3D
Stiff-Legged Dumbbell Deadlift;The dumbbell stiff-legged deadlift targets the hamstrings, glutes, low and upper back, as well as the core. The purpose of the stiff-legged, as opposed to Romanian deadlift with slightly bent knees, is to engage the hamstrings and low back to an even greater degree.;Strength;Hamstrings;Dumbbell;Intermediate;7.4;https://www.youtube.com/watch?v=_5DEdWpKYj4&pp=ygUeU3RpZmYtTGVnZ2VkIER1bWJiZWxsIERlYWRsaWZ0
Box jump;The box jump is an explosive exercise that strengthens the muscles of the lower body, including the quads, glutes, calves, and hamstrings. They also develop power in the lower body while revving the heart rate. Box jumps can be performed for low reps to focus on strength and power, or for higher reps for metabolic conditioning. Most coaches recommend stepping down rather than jumping down between reps.;Plyometrics;Hamstrings;Other;Beginner;9.4;https://www.youtube.com/watch?v=aDZoErlL1LQ&pp=ygUIQm94IGp1bXA%3D
Box Jump (Multiple Response);The box jump is a plyometric exercise that strengthens the muscles of the lower body, including the quads, glutes, calves and hamstrings. They also develop power in the lower-body while revving the heart rate.;Plyometrics;Hamstrings;Other;Intermediate;8.8;https://www.youtube.com/watch?v=OubJ6uPofF0&pp=ygUcQm94IEp1bXAgKE11bHRpcGxlIFJlc3BvbnNlKQ%3D%3D
Sled push-;The sled push is a conditioning exercise that targets the cardiovascular system and the muscles of the lower body. It involves pushing a sled along turf or another flat surface either for time or distance. Depending on your type of equipment, you may be pushing handles or straps in front of the sled. It can be used as part of a dynamic warm-up or for power training, as a finisher, or as part of a conditioning workout or circuit.;Cardio;Hamstrings;Other;Beginner;8.6;https://www.youtube.com/watch?v=9XRRXaUpnLk&pp=ygUKU2xlZCBwdXNoLQ%3D%3D
Lying Leg Curls;The lying leg curl is a popular machine-based exercise for the legs, particularly the hamstrings. It is similar to the seated leg curl, but the open hip angle in the lying leg curl may incorporate more glute and calf activation. It is usually performed for moderate to high reps, such as 8-12 reps per set or more, as part of a leg pre-exhaust or as a muscle-building movement for lower-body training.;Strength;Hamstrings;Machine;Beginner;8.1;https://www.youtube.com/watch?v=6y_GEg3YFC0&pp=ygUPTHlpbmcgTGVnIEN1cmxz
Glute Ham Raise;The glute ham raise is an exercise targeting the glutes and hamstrings on a GHD.;Powerlifting;Hamstrings;Machine;Intermediate;7.4;https://www.youtube.com/watch?v=c2pWqsHR7FU&pp=ygUPR2x1dGUgSGFtIFJhaXNl
Seated Leg Curl;The leg curl is a popular machine-based exercise for the legs, particularly the hamstrings. It comes in seated and lying varieties, but the seated leg curl machine is more common in commercial gyms. Leg curl variations are usually performed for moderate to high reps, such as 8-12 reps per set or more, as part of a leg pre-exhaust or as a muscle-building movement for lower-body training.;Strength;Hamstrings;Machine;Intermediate;8.9;https://www.youtube.com/watch?v=s_S60gTMTl8&pp=ygUPU2VhdGVkIExlZyBDdXJs
Smith machine stiff-legged deadlift;The Smith machine stiff-legged deadlift is a machine-based exercise targeting the muscles of the hamstrings, glutes, and upper back. The Smith machine mimics a barbell but provides more stability. This movement can be programmed like a traditional stiff-legged or Romanian deadlift, in low reps for strength or higher reps for muscle and strength endurance. It is often performed for moderate to high reps, such as 8-12 reps per set or more, as part of a full-body or lower-body workout.;Strength;Hamstrings;Machine;Beginner;8.4;https://www.youtube.com/watch?v=r9qKaA2hS5o&pp=ygUjU21pdGggbWFjaGluZSBzdGlmZi1sZWdnZWQgZGVhZGxpZnQ%3D
Natural Glute Ham Raise;The glute ham raise is an exercise targeting the glutes and hamstrings on a GHD.;Strength;Hamstrings;Body Only;Beginner;7.9;https://www.youtube.com/watch?v=mOuhARhkwzQ&pp=ygUXTmF0dXJhbCBHbHV0ZSBIYW0gUmFpc2U%3D
Standing leg swing;The standing leg swing is a dynamic stretching exercise that involves moving one leg up in front of you, as if to punt an imaginary football. This is a classic move for warming up the body and stretching the hamstrings.;Stretching;Hamstrings;Body Only;Beginner;7.0;https://www.youtube.com/watch?v=hxKfZlW1rys&pp=ygUSU3RhbmRpbmcgbGVnIHN3aW5n
Knee Tuck Jump;The tuck jump is a vertical jump, an explosive lower-body exercise that is a common way to measure explosive hip and lower-body strength in athletes. The more explosive you are, the higher you'll be able to jump.;Plyometrics;Hamstrings;Body Only;Intermediate;9.1;https://www.youtube.com/watch?v=2sl0KVJQWB8&pp=ygUOS25lZSBUdWNrIEp1bXA%3D
Inchworm;The inchworm is a popular bodyweight exercise that involves вЂњwalkingвЂќ the hands on the floor from a bent-over toe-touch position into a straight-arm plank. It is usually performed as part of a dynamic warm-up to help raise core body temperature and вЂњlimber upвЂќ the body from head to toe.;Stretching;Hamstrings;Body Only;Beginner;8.4;https://www.youtube.com/watch?v=t6EjIe4A-oI&pp=ygUISW5jaHdvcm0%3D
Lying groin stretch with band;The lying groin stretch with band is a simple way to stretch a chronically tight muscle group of the lower body. It is common in stretching and yoga classes but can also be performed individually as part of a warm-up, paired with movements in a workout, or as part of a cool-down or recovery strategy.;Stretching;Hamstrings;Body Only;Intermediate;8.1;https://www.youtube.com/watch?v=xTWzOMA5caQ&pp=ygUdTHlpbmcgZ3JvaW4gc3RyZXRjaCB3aXRoIGJhbmQ%3D
World's greatest stretch;The world's greatest stretch is a popular movement that earned its name because it targets multiple parts of the body, including the hips, shoulders, and thoracic spine, in a single sequence. This makes it a great dynamic warm-up, post-workout stretch, or mobility work you can do anytime.;Stretching;Hamstrings;Body Only;Intermediate;7.5;https://www.youtube.com/shorts/ftLV1SkpWAA
Glute ham raise-;The glute ham raise is an exercise targeting the glutes and hamstrings on a GHD, or glute ham developer bench. The unassisted version of the movement requires serious hamstring strength, so it is more common to see versions that use a band or PVC pipe for assistance. It is commonly performed as an accessory movement for heavy barbell lifts. While a single rep may be a struggle at first, with time, strong athletes can build up to doing them for 8-12 reps per set.;Strength;Hamstrings;Body Only;Beginner;6.7;https://www.youtube.com/watch?v=c2pWqsHR7FU&pp=ygUQR2x1dGUgaGFtIHJhaXNlLQ%3D%3D
Lying hamstring stretch with band;The lying hamstring stretch with band is a simple way to stretch a chronically tight muscle group of the lower body. It is common in stretching and yoga classes but can also be performed individually as part of a warm-up, paired with movements in a workout, or as part of a cool-down or recovery strategy.;Stretching;Hamstrings;Body Only;Beginner;4.4;https://www.youtube.com/watch?v=_oT3DjsdIns&pp=ygUhTHlpbmcgaGFtc3RyaW5nIHN0cmV0Y2ggd2l0aCBiYW5k
Alternating lunge jump;The alternating lunge jump is an explosive bodyweight exercise that targets the lower-body muscles, including the quads, glutes, and hamstrings. It can be performed for time or reps in power training, and is also effective in any fat-loss or athleticism-focused workout.;Stretching;Hamstrings;Body Only;Beginner;9.1;https://www.youtube.com/watch?v=1KGoFKarfiY&pp=ygUWQWx0ZXJuYXRpbmcgbHVuZ2UganVtcA%3D%3D
Exercise ball leg curl;The exercise ball leg curl is an exercise targeting the hamstrings. In particular, it targets the knee flexion function of the hamstrings, as opposed to deadlift variations, which target the other hamstring function, hip flexion. Many lifters opt for this exercise when they don't have access to a lying leg curl machine, but it is worth considering even if you already do machine curls.;Strength;Hamstrings;Exercise Ball;Intermediate;5.9;https://www.youtube.com/watch?v=WNB90xXLEOg&pp=ygUWRXhlcmNpc2UgYmFsbCBsZWcgY3VybA%3D%3D
Band-assisted pull-up;The band-assisted pull-up is a variation of the pull-up exercise in which the reps are performed with an elastic band looped around the feet or knees. This reduces weight and resistance at the bottom of the rep, while increasing it toward the top. Like other pull-up variations, it builds strength and muscle in the upper back, biceps, and core, and is often used as a way to help people boost their pull-up numbers or perform their first rep.;Strength;Lats;Bands;Intermediate;4.2;https://www.youtube.com/watch?v=A-uiFTIsgRg&pp=ygUVQmFuZC1hc3Npc3RlZCBwdWxsLXVw
Latissimus dorsi SMR;"Latissimus dorsi self-myofascial release (SMR) is a self-administered soft-tissue treatment for the upper body, usually using a foam roller, lacrosse ball, or other ""trigger point"" massage tool. By applying pressure strategically to the lat muscles of the mid back, some people find they can cause this often painful and tight area to relax or ""release."" Latissimus dorsi SMR is often accompanied by SMR on the pectorals or rhomboids, or by stretches that target the lats.";Stretching;Lats;Foam Roll;Intermediate;8.8;https://www.youtube.com/watch?v=1GaR-a9TWYM&pp=ygUUTGF0aXNzaW11cyBkb3JzaSBTTVI%3D
Bent-arm barbell pull-over;"The bent-arm barbell pull-over was a staple exercise of the ""Golden Era"" of bodybuilding and a favorite of Arnold Schwarzenegger himself. Done properly, the exercise targets the pecs, lats, and serratus anterior muscles. Old-school bodybuilders would perform them with light weights for sets of 20 between sets of heavy 20-rep squats, but pull-overs are more popular today in moderate rep ranges, such as 8-12 reps per set, as part of an upper-body workout.";Strength;Lats;Barbell;Intermediate;7.6;https://www.youtube.com/watch?v=7Oe6NoChaKo&pp=ygUaQmVudC1hcm0gYmFyYmVsbCBwdWxsLW92ZXI%3D
Weighted pull-up;The weighted pull-up is a more advanced variation of the pull-up exercise in which the lifter adds extra weight to their body. Options for adding weight include a dip belt, weighted vest, chains, a dumbbell placed between the feet or legs, or looping a kettlebell over the foot. Like other pull-up variations, the weighted pull-up builds strength and muscle in the upper back, biceps, and core.;Strength;Lats;Other;Intermediate;4.7;https://www.youtube.com/watch?v=C0I0gb76yaA&pp=ygUQV2VpZ2h0ZWQgcHVsbC11cA%3D%3D
Floor rope climb;The floor rope climb is an exercise that involves performing partial rope climbs in a prone position with the feet on the floor. It can help prepare someone for full rope climbs, but also trains the muscles of the back, biceps, and grip. It can be done for time or reps.;Strength;Lats;Other;Beginner;8.0;https://www.youtube.com/watch?v=BsDRv1fiXIY&pp=ygUQRmxvb3Igcm9wZSBjbGltYg%3D%3D
Close-grip pull-down;The close-grip pull-down is a variation on the lat pull-down that is performed with an overhand grip and the hands slightly closer than shoulder-width apart. This increases the range of motion beyond wider grips, and may increase the time under tension in each rep. This variation is usually performed for moderate to high reps as part of a back or upper-body workout.;Strength;Lats;Cable;Intermediate;9.5;https://www.youtube.com/watch?v=gZr4wiQTfMM&pp=ygUUQ2xvc2UtZ3JpcCBwdWxsLWRvd24%3D
Shotgun row;The shotgun row is a single-arm row variation utilizing a cable stack in a staggered stance. It targets the muscles of the middle back, like the lats (latissimus dorsi) and rhomboids, but also the core. It is usually performed for moderate to high-reps, at least 8-15 reps per set, in the later stages of a back or upper-body workout.;Strength;Lats;Cable;Intermediate;7.0;https://www.youtube.com/watch?v=hZzJJ0HJbvw&pp=ygULU2hvdGd1biByb3c%3D
Close-Grip Front Lat Pulldown;The close-grip pull-down is a variation on the lat pull-down, acable-based exercise machine thatвЂ™s ubiquitous in gyms around the world. This back builder is easy to learn and highly effective, allowing for variable resistance depending on where you place the pin in the stack.;Strength;Lats;Cable;Intermediate;8.9;https://www.youtube.com/watch?v=gZr4wiQTfMM&pp=ygUdQ2xvc2UtR3JpcCBGcm9udCBMYXQgUHVsbGRvd24%3D
Straight-arm rope pull-down;The straight-arm rope pull-down is a variation of the straight-arm lat pull-down performed using a cable stack machine and a rope grip. It can either be performed in an athletic upright stance, or slightly bent over. It both stretches and contracts the muscles of the lats (latissimus dorsi) as well as providing additional activation to the other upper back muscles and the core. Because the triceps are also isometrically involved in the movement, it is usually performed for higher reps, such as 8-15 reps or more.;Strength;Lats;Cable;Intermediate;8.9;https://www.youtube.com/watch?v=EurcOa-r9r4&pp=ygUbU3RyYWlnaHQtYXJtIHJvcGUgcHVsbC1kb3du
Lat pull-down;The lat pull-down is a cable-based exercise that's ubiquitous in gyms around the world. This back builder is easy to learn and highly effective at building back size and strength. It's usually trained in moderate to high reps, such as 8-12 reps per set. If grip strength is a limitation, you can wear wrist straps.;Strength;Lats;Cable;Intermediate;8.8;https://www.youtube.com/watch?v=OcFCHdQHjVU&pp=ygUNTGF0IHB1bGwtZG93bg%3D%3D
Straight-Arm Pulldown;The straight-arm bar pull-down is a variation of the straight-arm lat pull-down performed using a cable stack machine. It can either be performed in an athletic upright stance, or slightly bent-over. It both stretches and contracts the muscles of the lats (latissimus dorsi) as well as providing additional activation to the other upper back muscles and the core. Because the triceps are also isometrically involved in the movement, it is usually performed for higher reps, like 8-15 reps or above.;Strength;Lats;Cable;Intermediate;8.7;https://www.youtube.com/watch?v=wcVDItawocI&pp=ygUVU3RyYWlnaHQtQXJtIFB1bGxkb3du
Single-arm kneeling lat pull-down;The single-arm kneeling lat pull-down is a variation of the lat pull-down exercise performed one arm at a time, with the knees on the ground, rather than sitting on a bench or machine. It has all of the same benefits of a lat pull-down performed on a bench or machine, in addition to providing further activation to the core and lower body.;Strength;Lats;Cable;Beginner;8.6;https://www.youtube.com/shorts/KA0bfBIOxHY
Elevated Cable Rows;The cable seated row is a popular exercise to train the muscles of the upper back, including the lats (latissimus dorsi), traps, rhomboids, and rear deltoids, using a cable stack. It also targets the biceps to a lesser degree. The cable row can work well in a variety of rep-ranges, but is most popular in muscle-building workouts or as an accessory movement for strength workouts.;Strength;Lats;Cable;Beginner;8.3;https://www.youtube.com/watch?v=rEX2WT89u34&pp=ygUTRWxldmF0ZWQgQ2FibGUgUm93cw%3D%3D
Kneeling lat pull-down;The kneeling lat pull-down is a variation of the lat pull-down exercise performed with the knees on the ground rather than sitting on a bench or machine. It has all of the same benefits of a lat pull-down performed on a bench or machine, in addition to providing further activation to the core and lower body.;Strength;Lats;Cable;Intermediate;8.3;https://www.youtube.com/shorts/KA0bfBIOxHY
Behind-the-neck pull-down;The behind-the-neck pull-down is a cable exercise intended to target the muscles of the upper and middle back. If you have the requisite shoulder mobility, it can help you target the upper back muscles, including the trapezius and rhomboids, as well as the lats (latissimus dorsi). It is popular among elite bodybuilders and physique athletes, but some coaches consider it unsafe to the shoulder joint, particularly for people with existing shoulder problems.;Strength;Lats;Cable;Intermediate;8.3;https://www.youtube.com/watch?v=pLAd-py7T24&pp=ygUZQmVoaW5kLXRoZS1uZWNrIHB1bGwtZG93bg%3D%3D
Reverse-grip lat pull-down;The reverse-grip lat pull-down is variation on the lat pull-down that targets the lower lats more than an overhand grip. Because the hands are relatively close together, it also increases the range of motion beyond wider-grip pull-down variations. It can be performed for low reps, such as 5-6 per set, for back strength, or for higher reps for size.;Strength;Lats;Machine;Intermediate;7.9;https://www.youtube.com/watch?v=D-aYXhHBDI8&pp=ygUaUmV2ZXJzZS1ncmlwIGxhdCBwdWxsLWRvd24%3D
Machine seated row;The machine seated row is a popular exercise targeting the back muscles, particularly the lats (latissimus dorsi), rhomboids, and middle and lower trapezius. There is a wide variety of seated row machines, but most of them approximate the motion of a free-weight row, but in an upright, forward-facing position. Machine row variations are often performed for moderate to high reps, such as 8-12 reps per set or more, as part of an upper-body or back-focused portion of a workout.;Strength;Lats;Machine;Beginner;7.1;https://www.youtube.com/watch?v=TeFo51Q_Nsc&pp=ygUSTWFjaGluZSBzZWF0ZWQgcm93
